{
  "schema_version": "2.0",
  "contract_version": "2",
  "workflow_mode": "early-prototype",
  "template_set_version": "{{provenance.template_set_version}}",
  "source_url": "https://github.com/Druk83/ui-patterns.git",
  "revision": "{{provenance.revision}}",
  "status": "proposed",
  "screen_pool": "пул-экранов.json",
  "screens": [
    {
      "screen_id": "{{screen.screen_id}}",
      "specification": "screens/{{screen.screen_id}}.md",
      "status": "proposed",
      "pattern_refs": [],
      "template_refs": [],
      "reference_artifacts": []
    }
  ],
  "reference_sets": [
    {
      "reference_set_id": "{{reference_set.id}}",
      "path": "references/{{reference_set.id}}"
    }
  ],
  "traceability": [],
  "gaps": []
}
